{
  "run_id": "0197a3c2-5a00-7c00-9f00-000000000001",
  "profile": "sdlc/1",
  "scenario_tag": "SCN-A",
  "agent_mode": "SCRIPTED",
  "status": "RUNNING",
  "release_outcome": null,
  "terminal_reason": null,
  "plan_version": 1,
  "policy_catalogue_version": "v1.0",
  "parent_run_id": null,
  "created_at": "2026-10-16T10:00:00Z",
  "terminal_at": null,
  "nodes": [
    { "node_key": "N05_DECOMPOSE", "state": "SUCCEEDED", "attempt_count": 1 },
    { "node_key": "N09_IMPLEMENT", "state": "SUSPENDED", "branch": "capture", "attempt_count": 1, "suspended_reason": "material ambiguity (API contract): are HEAD requests counted as redirects?" },
    { "node_key": "N09_IMPLEMENT", "state": "RUNNING", "branch": "inspect", "attempt_count": 1 },
    { "node_key": "N10_DOCUMENT", "state": "PENDING", "branch": "inspect", "attempt_count": 0, "blocked_by": ["N09_IMPLEMENT:inspect"] },
    { "node_key": "N13_COMPLIANCE_CHECK", "state": "PENDING", "attempt_count": 0, "blocked_by": ["N15_VALIDATION_JOIN"] }
  ],
  "gates": [
    { "gate_id": "gate-amb-1", "gate_key": "G-AMB", "state": "OPEN", "deadline_at": "2026-10-17T10:00:00Z", "clock_kind": "WALL" }
  ],
  "blocked_paths": ["capture"],
  "pending_approvals": ["gate-amb-1"],
  "artifact_versions": [
    { "version_id": "av-1", "kind": "normalized-requirement", "version_no": 1, "status": "APPROVED", "content_hash": "0123456789abcdef0123456789abcdef0123456789abcdef0123456789abcdef" }
  ],
  "decision_ids": []
}
